{
  "$schema": "https://json-schema.org/draft/2020-12/schema",
  "$id": "https://vyper-auditor-skills/schemas/gate-status.schema.json",
  "title": "GateStatus",
  "type": "object",
  "required": [
    "prod_gate",
    "assurance_checks",
    "blocked_reasons",
    "warnings",
    "critical_high_validation_summary",
    "toolchain_status",
    "standards_gate_status",
    "artifact_paths"
  ],
  "additionalProperties": false,
  "properties": {
    "prod_gate": {"type": "string", "enum": ["PASS", "BLOCKED"]},
    "assurance_checks": {"type": "string", "enum": ["PASS", "BLOCKED"]},
    "blocked_reasons": {"type": "array", "items": {"type": "string"}},
    "warnings": {
      "type": "array",
      "items": {
        "type": "object",
        "required": ["code", "level", "message"],
        "additionalProperties": false,
        "properties": {
          "code": {"type": "string", "minLength": 1},
          "level": {"type": "string", "enum": ["INFO", "WARN"]},
          "message": {"type": "string", "minLength": 1},
          "source": {"type": "string"},
          "context": {
            "type": "object",
            "additionalProperties": {
              "type": ["string", "number", "boolean", "null"]
            }
          }
        }
      }
    },
    "critical_high_validation_summary": {
      "type": "object",
      "required": ["total", "confirmed", "rejected", "unverified"],
      "additionalProperties": false,
      "properties": {
        "total": {"type": "integer", "minimum": 0},
        "confirmed": {"type": "integer", "minimum": 0},
        "rejected": {"type": "integer", "minimum": 0},
        "unverified": {"type": "integer", "minimum": 0}
      }
    },
    "toolchain_status": {
      "type": "object",
      "required": [
        "mode",
        "status",
        "fail_open",
        "requested_tools",
        "executed_tools",
        "missing_tools",
        "failed_tools",
        "timed_out_tools",
        "critical_high_validation"
      ],
      "additionalProperties": false,
      "properties": {
        "mode": {"type": "string", "enum": ["required", "enabled", "disabled"]},
        "status": {"type": "string", "enum": ["PASS", "WARN", "SKIPPED", "BLOCKED"]},
        "fail_open": {"type": "boolean"},
        "requested_tools": {"type": "array", "items": {"type": "string", "enum": ["slither", "mythril", "echidna"]}},
        "executed_tools": {"type": "array", "items": {"type": "string", "enum": ["slither", "mythril", "echidna"]}},
        "missing_tools": {"type": "array", "items": {"type": "string", "enum": ["slither", "mythril", "echidna"]}},
        "failed_tools": {"type": "array", "items": {"type": "string", "enum": ["slither", "mythril", "echidna"]}},
        "timed_out_tools": {"type": "array", "items": {"type": "string", "enum": ["slither", "mythril", "echidna"]}},
        "blocked_reasons": {"type": "array", "items": {"type": "string"}},
        "critical_high_validation": {
          "type": "object",
          "required": ["total", "confirmed", "rejected", "unverified"],
          "additionalProperties": false,
          "properties": {
            "total": {"type": "integer", "minimum": 0},
            "confirmed": {"type": "integer", "minimum": 0},
            "rejected": {"type": "integer", "minimum": 0},
            "unverified": {"type": "integer", "minimum": 0}
          }
        }
      }
    },
    "standards_gate_status": {
      "type": "object",
      "required": [
        "standards_enforcement",
        "profile",
        "status",
        "required_packs",
        "available_packs",
        "missing_packs"
      ],
      "additionalProperties": false,
      "properties": {
        "standards_enforcement": {"type": "string", "enum": ["shadow", "enforced"]},
        "profile": {"type": "string"},
        "status": {"type": "string", "enum": ["PASS", "WARN", "SKIPPED", "BLOCKED"]},
        "required_packs": {"type": "array", "items": {"type": "string"}},
        "available_packs": {"type": "array", "items": {"type": "string"}},
        "missing_packs": {"type": "array", "items": {"type": "string"}},
        "blocked_reasons": {"type": "array", "items": {"type": "string"}}
      }
    },
    "artifact_paths": {
      "type": "object",
      "minProperties": 1,
      "additionalProperties": {"type": "string"}
    }
  }
}
